owner_id,full_name,passport_series,passport_number,passport_issued_by,address,phone,email
118,Носков Климент Гордеевич,9423,349565,АО «Веселов Владимиров»,"с. Набережные Челны, ул. Невского, д. 8/4 стр. 16, 029922",8 (092) 024-2869,shashkovaija@example.org
119,Кошелев Савва Харлампьевич,5562,801474,АО «Зимина Бирюков»,"д. Тихорецк, алл. Володарского, д. 2/4 к. 7/3, 038862",81279908811,vasilisa1977@example.net
120,Смирнова Нина Семеновна,8953,324643,"ИП «Мамонтова, Беляев и Гаврилова»","ст. Старая Русса, наб. Гражданская, д. 3/5 к. 4/2, 986430",+7 981 806 3565,stepanovparfen@example.net
121,Осипова Синклитикия Олеговна,9834,238739,Гурьев Лтд,"ст. Карабудахкент, пер. Клары Цеткин, д. 95 к. 5/5, 621372",+7 386 589 02 60,birjukovgalaktion@example.com
122,Нина Богдановна Голубева,8744,354801,АО «Гришин-Яковлев»,"с. Эльбрус, пер. Лунный, д. 827 стр. 538, 098839",+7 (053) 021-46-56,mlazareva@example.net
123,Крюков Архип Бенедиктович,8749,946721,Ермаков Лимитед,"ст. Кяхта, пер. Омский, д. 7/1, 268181",8 (451) 848-9476,uljana1983@example.com
124,Оксана Робертовна Самсонова,7669,299659,Дементьева Инк,"к. Борзя, бул. Проточный, д. 75 к. 9, 434165",+7 827 553 94 23,ninel1981@example.net
125,Белоусов Елисей Давыдович,2545,201639,ОАО «Чернов Игнатова»,"ст. Воткинск, ул. 8-е Марта, д. 880, 957947",+7 (846) 392-08-67,amos_1998@example.com
126,Дарья Робертовна Турова,8062,471507,ООО «Семенова»,"клх Алапаевск, бул. Союзный, д. 2/6, 942843",+77955276365,oleg_47@example.org
127,Игнатьева Елизавета Болеславовна,7939,531071,Фармперспектива,"ст. Омск, алл. Кавказская, д. 1/3, 728857",+74890612034,agafja1975@example.net
128,Мирослав Иосипович Шилов,8651,864491,Белозерова и партнеры,"с. Городовиковск, ш. Выгонное, д. 64 к. 9, 716947",+7 (256) 996-11-25,longinfilippov@example.net
129,Карл Тихонович Дорофеев,1887,806073,"ОАО «Дементьева, Мясникова и Владимиров»","п. Йошкар-Ола, алл. Белорусская, д. 2, 261117",8 (006) 811-4921,oorehov@example.org
130,Зуева Василиса Владимировна,2612,163556,Филатова Инкорпорэйтед,"клх Новомосковск, ш. Металлургов, д. 9/5 к. 3/9, 997968",8 (457) 831-7456,german40@example.org
131,Мишина Вера Макаровна,7596,863587,НПО «Тарасова-Соколов»,"к. Алдан, ш. Гагарина, д. 90 к. 4, 866326",8 341 638 94 48,ostromir31@example.org
132,Макаров Ратибор Филимонович,6559,939482,ООО «Федотова-Иванова»,"г. Екатеринбург, пер. Рабочий, д. 51, 270312",+7 735 647 5705,odintsovgalaktion@example.org
133,Никифор Артёмович Некрасов,2790,360735,"АО «Блинов, Авдеева и Крюкова»","ст. Александровск, ш. Новгородское, д. 8/4, 371837",8 452 088 14 74,miroslavbelozerov@example.org
134,Екатерина Вадимовна Фролова,4139,299448,Юг Руси,"п. Кыштым, ул. Димитрова, д. 10 стр. 3/6, 327195",+7 052 812 7358,porfiri_30@example.net
135,Всеволод Димитриевич Мясников,9786,570405,НПО «Кудряшова»,"д. Сургут (Хант.), пер. Технический, д. 6, 498218",+7 (744) 857-08-62,orehovamaja@example.net
136,Молчанов Арсений Терентьевич,3296,542374,ЗАО «Колесникова Соколова»,"к. Поярково, наб. Заозерная, д. 181 стр. 12, 173109",8 789 940 53 91,teterinaevfrosinija@example.net
137,г-н Абрамов Аркадий Иосипович,4006,392075,Панфилова Групп,"ст. Югорск, пер. Дорожный, д. 441 к. 913, 338392",8 (861) 957-6122,oleg_1998@example.net
138,Моисеев Пров Ильич,8579,361941,ЗАО «Кулагин-Кулакова»,"ст. Яшкуль, ш. Шевченко, д. 99 к. 96, 577600",+79082404335,mamontovairina@example.net
139,Дроздова Ульяна Владиславовна,2235,564656,РАО «Русаков»,"п. Кунгур, пер. Ленский, д. 54 к. 496, 572791",84096105566,bespalovzosima@example.net
140,Елисеева Агафья Мироновна,2604,153045,ИП «Богданова»,"д. Хабаровск, наб. Р.Люксембург, д. 12, 799813",8 462 251 79 08,fnazarov@example.com
141,Носова Василиса Валентиновна,9856,976638,"ЗАО «Афанасьев, Туров и Вишняков»","п. Бронницы, ш. Парижской Коммуны, д. 2 к. 666, 355904",+7 (597) 927-03-35,anzhelikamakarova@example.net
142,Блохин Якуб Виленович,1241,197793,РАО «Зимин-Тихонова»,"с. Соликамск, наб. Санаторная, д. 93, 879206",88042043940,valerija2023@example.org
143,Касьян Иосипович Князев,4872,274389,РАО «Логинов»,"с. Тикси, ул. Куйбышева, д. 9/2 стр. 93, 800384",8 762 055 5438,arkadi46@example.org
144,Ирина Дмитриевна Алексеева,7658,609231,НПО «Ширяева-Егоров»,"д. Элиста, бул. Моховой, д. 4/3 стр. 5/6, 823298",+7 (248) 262-9251,tverdislav_2023@example.org
145,Дьячков Галактион Аксёнович,8886,324130,НПО «Блохина-Бирюков»,"клх Кызыл, ш. Енисейское, д. 122, 999393",+7 (051) 728-9752,eivanova@example.org
146,Цветков Амос Устинович,7570,161483,ИП «Стрелкова»,"клх Канск, ул. Тепличная, д. 8/6, 366096",8 699 988 0817,andronik2019@example.org
147,Афанасьева Алина Федоровна,3697,497382,"ЗАО «Жданова, Боброва и Блохина»","к. Саранск, наб. Февральская, д. 3/7 к. 1, 771812",88266570279,radovantarasov@example.com
148,Гремислав Валерьевич Тарасов,1035,509386,ООО «Мясников»,"д. Оренбург, ш. Большое, д. 9/7 стр. 325, 220644",8 (421) 230-94-07,sigizmund2000@example.org
149,Горшкова Жанна Даниловна,5345,922157,Александрова Групп,"с. Валаам, пер. Лесный, д. 58 стр. 30, 050209",84510162249,demjan_2024@example.net
150,Тетерина Александра Богдановна,8454,399105,ИП «Зиновьев-Зыкова»,"ст. Ростов, ул. Гагарина, д. 3/2 стр. 6, 833901",88179469548,vladislav_99@example.com
151,Евдокимова Полина Святославовна,7930,830429,ЗАО «Абрамов Быкова»,"г. Глазов, пр. Пригородный, д. 79, 055830",+7 (441) 448-8501,matve_69@example.net
152,Дарья Георгиевна Суханова,8973,262316,ООО «Кондратьев-Гордеева»,"клх Дербент, алл. Бажова, д. 8 к. 1/9, 958803",85512405682,mdavidov@example.org
153,Ксения Кузьминична Рогова,4111,411120,ИП «Шарапов»,"п. Обоянь, ш. Дружбы, д. 58 к. 61, 317807",8 (235) 784-5218,evfrosinijavladimirova@example.org
154,Станимир Валентинович Иванов,4566,161324,РАО «Афанасьева-Молчанова»,"с. Баргузин, пер. Труда, д. 494, 334485",8 (142) 241-09-88,ershovtit@example.com
155,Дорофеева Вероника Ильинична,9883,163918,Емельянов Инкорпорэйтед,"д. Находка, пр. Березовый, д. 80 стр. 116, 662997",85453817921,valeri1995@example.net
156,Комиссарова Октябрина Руслановна,6138,159942,АО «Дмитриев Кононова»,"с. Ишим, бул. Тургенева, д. 8 стр. 1/2, 157724",8 992 816 1581,tverdislav76@example.net
157,Якуб Демьянович Хохлов,1821,712554,НПО «Комиссаров Титов»,"ст. Чокурдах, ш. Демьяна Бедного, д. 9 к. 22, 199758",+7 724 619 19 65,anzhela2007@example.org
158,Кудрявцев Фома Ааронович,8811,627276,ООО «Петухов Лихачев»,"д. Чебоксары, алл. Высокая, д. 5 к. 7, 190986",+7 (405) 800-85-14,frolovanina@example.net
159,Исаева Лариса Мироновна,9701,265080,"НПО «Беспалов, Андреева и Родионов»","п. Калач, пр. Терешковой, д. 3/5 стр. 12, 027621",+7 (679) 692-78-68,nestor1990@example.org
160,Аверьян Эдуардович Сазонов,1931,632496,ММС Рус (Mitsubishi Motors),"д. Чебаркуль, ул. Почтовая, д. 6/2 к. 2/3, 781891",+7 (718) 949-0580,radovan1998@example.com
161,Суханова Наина Матвеевна,2312,992697,ИП «Миронов-Богданов»,"г. Ярославль, пер. Краснодарский, д. 149 к. 8, 281442",84440192927,demid_43@example.com
162,Лобанов Амос Измаилович,4044,171849,АО «Соболева»,"ст. Прохладный, алл. Щетинкина, д. 63 к. 141, 767478",+7 (667) 428-6047,ushcherbakova@example.net
163,Волкова Антонина Тарасовна,2113,808011,Ферреро Руссия (Ferrero),"к. Куртамыш, ш. Гражданское, д. 7 к. 4/4, 258001",+7 618 175 3443,kozlovajulija@example.org
164,Кириллов Ерофей Валерьевич,4853,523389,Т2 РТК Холдинг,"с. Ханты-Мансийск, ул. Воронежская, д. 5, 174654",+7 (140) 665-04-42,arhip1997@example.org
165,Борисова Пелагея Борисовна,2964,697347,ЗАО «Шилова Самойлов»,"с. Кропоткин (Краснод.), ул. Станционная, д. 894, 720064",+7 (569) 087-76-61,zinovi_1970@example.net
166,Ольга Васильевна Ермакова,5033,707040,Рожкова и партнеры,"с. Белоярский, бул. Революционный, д. 9 стр. 2, 432806",+7 (461) 571-7320,akimmolchanov@example.net
167,Колесников Арсений Ефремович,1651,749468,"ЗАО «Пестова, Шубина и Юдина»","г. Невельск, наб. Западная, д. 2/4, 829310",+7 (707) 903-20-20,valeri79@example.org
168,Ангелина Борисовна Андреева,2343,539589,"ЗАО «Ефремова, Сидорова и Быков»","с. Нарьян-Мар, бул. Короленко, д. 2 стр. 45, 925114",+7 (625) 827-39-02,vishnjakovjuli@example.com
169,Акулина Рудольфовна Федорова,9565,431737,РАО «Ефимов»,"с. Сортавала, алл. Ясная, д. 94 стр. 7/4, 909279",+7 456 083 31 81,sinklitikija_88@example.org
170,Ярослав Глебович Егоров,5272,314181,АО «Цветков»,"с. Игнашино, бул. Московский, д. 454, 459701",+7 822 078 1137,pankrat_35@example.org
171,Лидия Евгеньевна Комарова,6147,350280,ООО «Шарапов Фадеева»,"п. Бугульма, пер. Водников, д. 462 к. 3/7, 273543",8 209 042 1776,lukijapoljakova@example.com
172,Вишнякова Эмилия Викторовна,5351,515011,Силина Лтд,"с. Троицк (Челяб.), ш. Полтавское, д. 8/5 к. 463, 693929",+7 600 780 6867,savelevserafim@example.org
173,Ситников Агап Устинович,3144,804318,АО «Терентьев Капустин»,"г. Сочи, наб. Алтайская, д. 1/8 стр. 3/7, 570165",8 (046) 498-9319,nina_08@example.net
174,Антонин Брониславович Блинов,5915,579434,НПО «Осипова-Федоров»,"п. Устюжна, ул. Логовая, д. 45 стр. 479, 554864",+7 155 778 8178,kuzma_1995@example.com
175,Ангелина Георгиевна Рожкова,6180,888387,"РАО «Сорокин, Шаров и Зыкова»","г. Вуктыл, наб. Боровая, д. 37, 804682",8 (567) 043-10-38,ostap_95@example.net
176,Большакова Пелагея Эдуардовна,2188,109767,Юг-Авто,"к. Хасавюрт, ш. Фрунзе, д. 44, 540254",8 (292) 842-22-23,volkovlukjan@example.net
177,Осипов Моисей Гаврилович,8508,751332,ЗАО «Быкова Виноградов»,"п. Объячево, пер. Тополиный, д. 2 к. 367, 520885",+77492975170,taisijaandreeva@example.com
178,Орехов Ефим Филатович,2638,176819,РАО «Лапин-Макаров»,"ст. Лабинск, ул. Народная, д. 2/9, 375998",+7 562 656 5045,leon_78@example.org
179,Белозеров Прокл Фёдорович,9808,323508,"ИП «Большаков, Калашникова и Архипова»","п. Черусти, ул. Средняя, д. 84 стр. 2, 106462",8 (792) 326-4870,foti47@example.net
180,Цветкова Алевтина Александровна,9288,378082,ИП «Моисеев Колобова»,"клх Луховицы, алл. Победа, д. 20 к. 8, 959796",+77158904290,larisasuvorova@example.net
181,Сорокин Аполлинарий Егорович,3170,465962,НПО «Анисимова-Сазонова»,"к. Люберцы, бул. Магистральный, д. 22 стр. 68, 445189",8 202 845 7652,rjabovgerman@example.net
182,Пономарев Федот Валентинович,2127,356150,"НПО «Гордеева, Степанов и Жуков»","с. Нижневартовск, бул. Гастелло, д. 97 к. 3, 013223",+72321611076,lazarevavalentina@example.org
183,Раиса Эдуардовна Семенова,7054,398830,"РАО «Одинцова, Селезнев и Беляев»","клх Александров, ш. Волжское, д. 49, 501249",8 528 938 9119,lobanovaekaterina@example.net
184,Бобров Данила Абрамович,3584,559469,Национальная компьютерная корпорация,"к. Чикола, пр. Загородный, д. 75, 383615",+7 718 275 48 01,semen_16@example.com
185,Леонтий Феофанович Цветков,9900,837715,Авдеев и партнеры,"ст. Братск, бул. Нахимова, д. 80 к. 967, 126691",+7 (153) 539-61-36,klavdi2013@example.net
186,Симонова Милица Матвеевна,5956,741390,"ООО «Данилова, Стрелкова и Корнилов»","п. Сергиев Посад, ул. Сплавная, д. 8/4, 010170",+7 (695) 249-91-18,ruben1981@example.net
187,тов. Потапов Мефодий Аверьянович,9666,108203,НПО «Шарова»,"с. Можга, пр. Высоцкого, д. 902 к. 3, 624671",87889778280,fnazarov@example.net
188,Эмилия Матвеевна Комиссарова,5905,795613,ИП «Ильин-Павлов»,"ст. Ноябрьск, ш. Нагорное, д. 7 к. 665, 503334",81141520850,varvara2018@example.net
189,Гаврилова Ираида Архиповна,2697,240814,Силовые машины,"с. Холмогоры, наб. Гражданская, д. 2/4 к. 8, 294563",8 (183) 440-49-63,terentevfoka@example.org
190,Дорофеева Ангелина Феликсовна,5333,221035,Селиверстов Групп,"ст. Бузулук, ш. Дружбы, д. 7 стр. 4, 649878",+7 (082) 973-74-89,krozhkova@example.net
191,Галкина Евпраксия Михайловна,2753,878480,"АО «Трофимов, Антонов и Михеева»","с. Морозовск, бул. Одесский, д. 5/5, 493631",+7 (303) 477-86-60,gordedorofeev@example.org
192,Вишняков Клавдий Вячеславович,3546,385577,МегаФон,"г. Великий Устюг, пер. Победы, д. 265 к. 3/4, 981898",+77139155963,jkudrjashov@example.org
193,Лыткин Кир Феоктистович,5616,734210,"ИП «Дементьева, Медведева и Макаров»","клх Гаврилов-Ям, пер. Олега Кошевого, д. 4/5 к. 85, 409003",+78645183760,qshashkova@example.com
194,Бирюков Измаил Ефимович,4450,852470,ОАО «Брагина Марков»,"ст. Плесецк, наб. Тихая, д. 8/7, 612481",8 698 570 0272,vlasovaevpraksija@example.net
195,Фирс Архипович Макаров,6617,313487,АО «Павлова Савельева»,"ст. Моршанск, пр. Запрудный, д. 3 к. 5, 165266",83008931734,allavlasova@example.net
196,Казимир Вилорович Беляев,5325,629959,АО «Фомичева-Яковлева»,"клх Тула, ш. Просвещения, д. 2/4 к. 53, 762639",+7 (436) 262-0443,ipat1990@example.net
197,Михайлова Агафья Руслановна,9004,363319,ОАО «Юдин Лыткина»,"клх Орел, пр. Таманский, д. 118 стр. 853, 990048",86465280924,praskovjagorshkova@example.com
198,Василиса Богдановна Филиппова,1832,196781,Нова,"к. Гдов, ул. Полярная, д. 5/6 к. 5/5, 856257",+7 (870) 320-32-07,gremislav76@example.org
199,тов. Волкова Нинель Матвеевна,7939,969634,Башкирэнерго,"с. Гаврилов-Ям, ш. Тенистое, д. 451 стр. 3, 849939",+7 892 613 7150,ekaterina16@example.com
200,Селиверстова Валентина Леонидовна,5533,146228,РАО «Сорокин Русаков»,"клх Курск, бул. Садовый, д. 1 стр. 6/3, 045018",86164236103,marijaguljaeva@example.com
201,Герасим Валерианович Петухов,1058,449759,"ОАО «Князев, Горшкова и Калашникова»","к. Владикавказ, пер. Крымский, д. 8/7 к. 5/7, 659266",+7 085 732 78 81,ruslan61@example.com
202,Владимир Ефимович Одинцов,3143,768061,ЗАО «Красильников Капустин»,"г. Токма, пер. Шмидта, д. 2/8, 549180",+7 722 601 64 59,regina2007@example.net
203,Лукия Геннадиевна Соболева,5291,269430,РАО «Михеева Жукова»,"с. Тырныауз, ул. Геологов, д. 802, 697499",8 641 220 3103,nikitinaolga@example.net
204,Журавлев Поликарп Геннадиевич,8239,678478,ИП «Воронцова»,"с. Ребриха, ул. Ольховая, д. 87, 079334",86050166799,kornil_1972@example.com
205,Харлампий Чеславович Жуков,8007,688153,ДНС Групп,"д. Моздок, ул. Флотская, д. 8/2 стр. 6/8, 024375",8 (383) 959-72-46,rpahomova@example.net
206,Евсеева Олимпиада Валериевна,1158,217308,Аксенов и партнеры,"п. Иваново, алл. Победа, д. 567, 380054",8 228 015 6193,shilovzahar@example.com
207,Матвей Ильич Комиссаров,2232,824586,ОАО «Гуляева»,"ст. Тольятти, бул. Крайний, д. 277 стр. 299, 812135",+7 (478) 712-55-21,porfirilitkin@example.com
208,Агата Ефимовна Щукина,3442,672092,"ИП «Дроздов, Морозова и Александров»","к. Псков, бул. Высоковольтный, д. 78 к. 72, 678507",+7 (081) 155-62-60,cpotapova@example.net
209,Виктория Филипповна Павлова,1590,975136,Петролеум Трейдинг,"с. Усть-Калманка, бул. Матросова, д. 1 к. 9, 673899",8 (563) 410-85-62,timur_1986@example.org
210,Никифорова Регина Львовна,7049,710805,Акрон,"ст. Улан-Удэ, наб. Тульская, д. 7 стр. 505, 101749",+7 753 998 9354,galina92@example.net
211,Иосиф Бориславович Большаков,3426,550664,Пономарева Инкорпорэйтед,"г. Домодедово, пр. Морозова, д. 710 стр. 47, 158698",8 (649) 767-7622,vladimir_1997@example.com
212,Крюков Соломон Валерианович,3088,143860,Вольво Восток (AB Volvo),"г. Енисейск, наб. Стадионная, д. 2/2 стр. 5, 821545",+74702296044,dobromislzikov@example.net
213,Виталий Иларионович Виноградов,6050,482364,НПО «Силин»,"к. Октябрьское (Хант.), ш. Шахтерское, д. 88 к. 8/3, 199663",8 580 741 20 94,anzhela_1976@example.net
214,Пестов Ян Антипович,1653,475190,Виноградова Инкорпорэйтед,"г. Тутончаны, ул. Прохладная, д. 83, 895690",8 (056) 260-85-64,andreevvalerjan@example.net
215,Баранов Добромысл Дмитриевич,4441,815198,АО «Горбачев»,"г. Эльтон, алл. Нагорная, д. 246 к. 3, 546103",+7 (993) 788-6140,rostislav_86@example.org
216,Орест Даниилович Сысоев,5088,799330,ИП «Титова»,"ст. Усть-Катав, ш. Кедровое, д. 7 стр. 2/9, 258238",8 870 079 42 00,kim2003@example.net
217,Милий Гордеевич Логинов,2684,470858,Воронцов Инк,"к. Верхний Уфалей, бул. Красногвардейский, д. 58 к. 4/9, 547435",8 379 502 0970,muravevadarja@example.com
218,Игнатова Пелагея Никифоровна,7658,750810,Сорокин Лимитед,"ст. Саянск, ул. К.Маркса, д. 6/7 стр. 20, 537030",+75319433750,semen93@example.org
219,Бирюков Николай Брониславович,3532,348237,ЗАО «Козлова-Кузнецова»,"клх Ханты-Мансийск, бул. Ягодный, д. 292 стр. 44, 308948",8 (060) 566-41-87,mitofan1999@example.org
220,Елена Альбертовна Матвеева,3662,938742,"ЗАО «Самсонов, Евдокимов и Кузнецов»","к. Ведено, ш. Восточное, д. 26 стр. 33, 411076",+7 954 317 3505,izot_2023@example.net
221,Фадеева Антонина Петровна,3900,532322,Крылов Инк,"с. Мичуринск, ул. Полярная, д. 570 стр. 2/2, 804661",86399076769,shirjaevaleksandr@example.com
222,Сафонова Евдокия Борисовна,1406,288073,РАО «Соболева»,"д. Грозный, пер. Таманский, д. 7 стр. 8/3, 200249",8 854 982 27 49,kuzma_50@example.net
223,Ларионова Вероника Аркадьевна,6442,920391,ЗАО «Нестерова Шубина»,"к. Каменск-Уральский, бул. Проезжий, д. 853, 959959",+76521707303,rubenefremov@example.org
224,Зиновьев Максимильян Матвеевич,7745,941204,НПО «Фомин Муравьева»,"г. Бугульма, ул. Донская, д. 84 к. 69, 033423",+72583230241,nikonovavera@example.com
225,Доронина Валерия Львовна,5065,379766,ИП «Сысоев Архипов»,"клх Златоуст, ш. Блюхера, д. 312 стр. 93, 559630",89384253042,foti_2020@example.org
226,Шарова Олимпиада Юрьевна,3608,925622,АО «Волкова»,"с. Торжок, алл. Космонавтов, д. 9 к. 8/8, 969033",+7 (736) 346-6925,uljan12@example.org
227,Спартак Ильич Данилов,2771,501124,Михайлов Групп,"с. Снежинск, пр. Нахимова, д. 6/5 к. 1/3, 341514",8 (881) 431-1150,evstigne_1988@example.net
228,Ладислав Елизарович Пономарев,1634,593554,Техинком,"г. Малая Вишера, ш. Новоселов, д. 7/1 к. 9/3, 333738",88775153663,radim2018@example.org
229,Флорентин Валерьянович Тимофеев,4644,309267,Магнит,"к. Кимры, пр. 50 лет ВЛКСМ, д. 6 к. 390, 599996",8 361 863 71 59,alla2020@example.org
230,Муравьев Фадей Вячеславович,8541,466643,ОАО «Власова»,"п. Камышин, пр. Дальневосточный, д. 53, 705802",8 662 128 6716,vladislavbespalov@example.org
231,Савелий Владиленович Елисеев,6000,960394,Мясникова и партнеры,"к. Каневская, алл. Подстанция, д. 469, 977790",+7 475 469 26 32,yfomichev@example.net
232,Ермаков Валентин Тимурович,4728,333752,Ростелеком,"к. Яр-Сале, наб. Ленинградская, д. 77 стр. 251, 672438",+7 701 765 6360,maksimovavalerija@example.net
233,Лидия Рубеновна Мартынова,1387,792094,"РАО «Сергеев, Ковалева и Ширяева»","п. Соликамск, ш. Алтайское, д. 20 к. 24, 210427",8 230 837 0816,prokl09@example.org
234,Мельников Егор Денисович,4164,517821,АО «Власов-Королев»,"г. Алексин, ш. Хуторское, д. 331 к. 70, 558393",8 (661) 331-5520,usuhanova@example.org
