owner_id,full_name,passport_series,passport_number,passport_issued_by,address,phone,email
1,Козлова Ирина Ефимовна,2824,126225,АО «Чернова Ершов»,"г. Артем, алл. Лесозаводская, д. 983, 379402",8 542 351 16 15,ernest_40@example.net
2,Владилен Матвеевич Федоров,5506,356787,Сафонов Лимитед,"клх Братск, бул. Курский, д. 2, 164752",8 534 192 8327,opotapov@example.net
3,Зимина Лидия Аркадьевна,4657,246316,ОАО «Голубев Калашникова»,"к. Бологое, пер. Островского, д. 77, 242388",+79696532871,samolovavalerija@example.org
4,Вишнякова Наталья Эльдаровна,2679,809570,НПО «Фадеев»,"д. Александров Гай, бул. Донской, д. 6 стр. 346, 048281",+78932528809,selivan_01@example.com
5,Ксения Егоровна Павлова,9935,191161,ЗАО «Фомичева Яковлев»,"ст. Боровск, ш. Кедровое, д. 97 стр. 94, 383465",8 (871) 331-50-98,haritonpoljakov@example.org
6,Евдокимов Аристарх Давыдович,7912,133326,РАО «Кононова»,"д. Когалым, бул. Вахитова, д. 38 к. 4/8, 311656",8 701 065 13 33,prohor_1977@example.org
7,Ипат Артемьевич Зуев,1488,198246,Лазарев Инк,"ст. Ковров, пр. Вахитова, д. 4/7, 260647",+76872343098,dementevalarisa@example.org
8,Архипов Сила Владиленович,4582,343962,ЗАО «Сорокин»,"д. Борзя, ш. Белорусское, д. 2/4 стр. 791, 435346",+7 (475) 107-99-11,ermil_1998@example.org
9,Ангелина Ефимовна Фомина,9279,731262,АО «Шашков-Пахомова»,"клх Усть-Камчатск, бул. Крайний, д. 24 к. 582, 935348",8 (401) 640-05-24,ninelzhdanova@example.net
10,Авксентий Брониславович Воробьев,1434,688508,ФСК Лидер,"д. Усть-Ишим, пр. Полярный, д. 145, 331586",82322602563,gorde16@example.org
11,Елена Геннадьевна Зыкова,4257,850800,"ИП «Костин, Харитонова и Горбачева»","г. Калуга, наб. Медицинская, д. 945 к. 9/6, 142940",+7 965 569 81 69,iraklisolovev@example.net
12,Спиридон Герасимович Громов,9928,539898,"РАО «Русакова, Казакова и Князева»","клх Гремячинск (Бурят.), наб. 9 мая, д. 7 стр. 7, 823662",89468044369,ruben_77@example.net
13,Мухин Давыд Архипович,4611,571029,ЗАО «Шестакова-Калинина»,"ст. Кисловодск, наб. Хвойная, д. 12 стр. 237, 693676",+7 (201) 632-8708,vitalipanov@example.org
14,Светлана Федоровна Кириллова,5557,948749,ОАО «Константинова-Доронин»,"п. Сорочинск, наб. Покровская, д. 9 к. 4/5, 143455",8 (122) 362-3166,tit_76@example.org
15,Гаврилов Никита Адамович,1106,895667,Мишин Групп,"к. Охотск, пер. Проточный, д. 4/5 к. 8/1, 562729",8 (069) 901-6272,osipovamarina@example.com
16,Большаков Мартын Тарасович,3615,832052,ОАО «Гущина-Зимина»,"ст. Ведено, ул. Интернациональная, д. 4 к. 400, 092327",+7 937 452 99 12,velimir90@example.com
17,Бурова Марина Никифоровна,7924,456778,Казаньоргсинтез,"г. Малоярославец, пер. Киевский, д. 758 стр. 2, 067165",8 (262) 849-87-76,ljubomir31@example.com
18,Зинаида Рубеновна Ермакова,5552,263032,Денисова Групп,"с. Мураши, пр. Сахалинский, д. 5, 494808",+7 (136) 783-7770,anisimovefrem@example.com
19,Тимофеева Фаина Максимовна,4527,900581,"ЗАО «Михайлова, Пахомов и Якушев»","клх Серафимович, наб. Ударная, д. 41 к. 2, 337498",84134352408,irinasoloveva@example.org
20,Игнатова Василиса Рудольфовна,6514,207175,ОАО «Козлов»,"с. Сарапул, алл. Больничная, д. 8 к. 816, 902294",+7 318 699 93 86,prov1986@example.net
21,тов. Ермакова Юлия Аркадьевна,2519,498382,Фокина Лимитед,"клх Каспийск, бул. Широкий, д. 33 к. 720, 974034",+77134936183,iraidasharapova@example.org
22,Сергеев Леон Ермилович,2584,476417,"РАО «Колобов, Власова и Кошелев»","д. Улан-Удэ, пр. Тихий, д. 565 к. 113, 902787",+72967175655,gordeevgostomisl@example.com
23,Серафим Ермилович Нестеров,6635,733052,"ОАО «Некрасова, Ильина и Богданов»","к. Краснодар, ул. 50 лет ВЛКСМ, д. 787 к. 638, 703482",+77710932480,orest_1975@example.org
24,Викторин Витальевич Чернов,5333,946335,ДСК Автобан,"ст. Старый Оскол, алл. Иванова, д. 46 к. 51, 584044",89727875588,usisoev@example.org
25,Жанна Филипповна Блинова,1711,865179,ОАО «Игнатьева Бирюков»,"клх Соловки, ш. Революции, д. 3/8 стр. 628, 718702",8 217 459 61 58,uteterina@example.net
26,Мишина Пелагея Тимофеевна,8527,662275,ЗАО «Кудрявцев»,"п. Верхотурье, ул. Сиреневая, д. 3/5 к. 105, 556238",8 922 219 69 37,elizavetasuvorova@example.net
27,Ираклий Августович Мясников,3045,496922,"ИП «Мельникова, Андреева и Веселов»","к. Черусти, бул. Новостройка, д. 8 к. 4, 713695",84406409097,fekla39@example.com
28,Пономарев Якуб Димитриевич,2291,678856,Мираторг,"к. Сарапул, пер. Радищева, д. 51, 623285",8 (842) 474-5171,elenasamolova@example.net
29,Афанасьева Тамара Михайловна,5803,969693,ОАО «Вишняков»,"д. Горячинск, наб. Васильковая, д. 6/2 к. 17, 931746",+7 200 471 13 82,xburov@example.net
30,София Николаевна Сафонова,6925,705397,ОХК Уралхим,"ст. Сургут (Хант.), пр. Заливный, д. 853 стр. 4/6, 585064",+7 (171) 390-0532,arhipnikonov@example.net
31,Рябов Игорь Игнатович,4150,838797,ОАО «Шарапова Рябова»,"ст. Долинск, пер. Сплавный, д. 11, 053950",+7 (402) 681-17-75,hristofor_1976@example.net
32,Горбачев Аникей Ефимьевич,2139,148050,"ООО «Селиверстова, Семенов и Ильин»","с. Всеволожск, бул. Сурикова, д. 315 к. 924, 698478",86118367365,nifont1993@example.org
33,Лонгин Дмитриевич Давыдов,4733,910620,ООО «Беспалова Блохин»,"ст. Верещагино (Перм.), пр. Гаражный, д. 3, 988516",8 604 945 1983,olgatsvetkova@example.org
34,Федор Исидорович Андреев,5741,183667,ЗАО «Савельев-Кабанова»,"д. Курганинск, алл. Абрикосовая, д. 6, 022961",+7 (018) 366-75-25,marina59@example.net
35,Зайцев Герман Владиленович,4814,205907,Комаров Лимитед,"с. Ржев, пер. Щербакова, д. 5/4 к. 256, 978403",8 900 343 24 45,ivanovserge@example.net
36,Владислав Тарасович Лукин,7227,391476,СК Росгосстрах,"с. Баксан, ул. Высоцкого, д. 759 к. 7/5, 605297",8 161 369 6816,olimpiada53@example.com
37,Анжела Степановна Калашникова,8428,766563,ЗАО «Соловьева»,"к. Дубна, ул. Краснофлотская, д. 4, 921277",89799552717,akulina1987@example.com
38,Казакова Прасковья Анатольевна,6977,270555,НПО «Лихачев-Воробьев»,"ст. Луга, бул. Революционный, д. 8/9, 793597",8 (207) 151-8203,porfiri1999@example.net
39,Давыдов Кондрат Терентьевич,7065,472528,"ОАО «Ларионов, Щербакова и Полякова»","г. Мытищи, пер. 50 лет Победы, д. 5, 519254",8 291 486 52 81,xvolkova@example.org
40,Дмитрий Гордеевич Александров,4432,802729,"АО «Савельев, Егоров и Никифоров»","ст. Вологда, ш. Почтовое, д. 3 стр. 3/3, 927065",+7 (794) 738-3473,evfrosinija_97@example.com
41,Марина Сергеевна Лобанова,5374,835911,"АО «Прохорова, Власов и Исаева»","г. Ставрополь, пер. Пушкинский, д. 341 к. 8, 613750",8 068 536 15 30,valerjan_52@example.org
42,Фомичев Савва Викентьевич,2169,738720,Силовые машины,"г. Ангарск, алл. Кавказская, д. 2/5 к. 24, 369711",8 (980) 893-24-60,ilarion_96@example.org
43,Михайлова Светлана Михайловна,3803,660086,ЗАО «Макарова»,"ст. Советский, бул. Красина, д. 5, 515319",8 205 852 7722,terentevratmir@example.org
44,Аникей Германович Доронин,5010,271339,ИП «Белозерова»,"ст. Урус-Мартан, наб. Подгорная, д. 64 к. 254, 667652",8 (758) 416-16-92,kuprijan_1988@example.org
45,Лавр Ефремович Третьяков,8573,497887,Рыбакова Групп,"к. Северо-Курильск, бул. К.Маркса, д. 5/1, 658202",87021355690,nonnablohina@example.com
46,Бажен Викентьевич Лобанов,5422,771088,НПО «Исаев-Маркова»,"г. Ардон, алл. Тюленина, д. 9/2 стр. 5, 394731",+7 (172) 715-51-88,ladimir22@example.com
47,Ильина Евпраксия Валентиновна,4598,817870,ОАО «Кузнецова Зайцев»,"с. Усть-Илимск, пер. Дальний, д. 846, 691251",8 (785) 289-22-68,nikonovavarvara@example.net
48,Сергеев Гостомысл Захарьевич,6313,983794,Макдоналдc (McDonald`s),"ст. Быково (метеост.), алл. Прохладная, д. 94 к. 382, 995900",+7 094 396 90 78,anastasija47@example.org
49,Милица Кузьминична Панова,1916,340174,ООО «Ковалев»,"с. Стерлитамак, алл. 50 лет Октября, д. 65 к. 7, 588153",8 (147) 321-04-69,kchernov@example.com
50,Лариса Георгиевна Фадеева,1525,944151,НПО «Зайцева Колобов»,"с. Апрелевка, пр. З.Космодемьянской, д. 4/4, 004797",+78016245650,korlov@example.net
51,Жданов Константин Артёмович,6168,520651,"ЗАО «Мясников, Жданова и Ильина»","п. Владимир, наб. Лазо, д. 3 к. 99, 800025",8 (872) 982-59-52,vsidorova@example.com
52,Селезнева Раиса Тарасовна,5386,169403,"ООО «Алексеева, Моисеев и Селиверстов»","к. Выборг, пер. Свердлова, д. 597 к. 80, 896230",81307562636,fevronija_2004@example.com
53,Анастасия Валентиновна Михеева,4456,694731,ЗАО «Кулагин Шестакова»,"к. Иваново, пер. Володарского, д. 5 к. 4/4, 843443",8 (575) 844-19-86,wnesterova@example.org
54,Константин Артурович Коновалов,6155,322955,"ООО «Копылов, Михеева и Кондратьев»","ст. Углич, пер. Городской, д. 41 к. 90, 301657",+7 208 267 73 45,anzhela01@example.net
55,Лукина Александра Вячеславовна,9179,514850,"ОАО «Казаков, Рожкова и Самойлова»","ст. Таганрог, бул. Малиновый, д. 204, 478872",8 (743) 152-7420,lavr_93@example.org
56,Кабанова Милица Олеговна,8517,249811,Лапин Инк,"п. Дивногорск, наб. Новгородская, д. 446 к. 5/6, 990453",+7 174 268 4145,efimkondratev@example.org
57,Радован Марсович Аксенов,5339,246413,171 Меридиан,"ст. Котлас, ш. Широкое, д. 9/6 стр. 191, 982258",8 (139) 718-70-72,pavel_1995@example.org
58,Муравьева Ксения Архиповна,5040,881177,"ИП «Прохорова, Иванов и Копылова»","г. Ревда (Сверд.), бул. Вишневый, д. 117 к. 7, 265676",8 182 512 86 82,avdesimonov@example.org
59,Октябрина Тимофеевна Родионова,9830,375504,Мишин Инкорпорэйтед,"к. Елец, алл. Урожайная, д. 169 к. 23, 907903",+7 673 830 2843,florentin_95@example.org
60,Гаврила Гурьевич Тихонов,8019,711878,ИП «Ильин-Кудрявцева»,"д. Таганрог, наб. Революции, д. 7, 246287",+7 (342) 708-6688,marijanikolaeva@example.com
61,Юдин Богдан Филимонович,7543,479580,РАО «Белова-Воронова»,"к. Октябрьское (Хант.), пер. Вокзальный, д. 939 стр. 47, 403317",+7 (936) 385-4678,leon_45@example.net
62,Октябрина Болеславовна Брагина,4593,245051,Силовые машины,"к. Мичуринск, ул. Черноморская, д. 50 к. 5/3, 536937",8 (547) 772-5228,dobroslav2021@example.net
63,г-жа Назарова Александра Анатольевна,9348,617488,Автотор холдинг,"п. Ясный (Оренб.), ул. Короткая, д. 838, 099770",+7 886 008 4840,ija_2008@example.org
64,Белов Станислав Вилорович,2489,892495,АО «Белоусова Воробьева»,"к. Переславль-Залесский, наб. Кольцова, д. 4/4, 101666",8 (700) 217-6591,andronik_1982@example.net
65,Олимпиада Ивановна Соловьева,1771,214975,ООО «Уварова»,"п. Можга, алл. Средняя, д. 2/5, 939685",8 218 501 63 15,xsilina@example.com
66,Дорофеев Радим Эдгардович,3504,757924,ИП «Титова Лихачева»,"п. Черняховск, пр. Кольцевой, д. 4 стр. 314, 265511",+7 475 412 1267,fedor_1998@example.org
67,Казаков Фадей Бенедиктович,3621,930555,Полякова и партнеры,"к. Псебай, ш. Промышленное, д. 99 к. 36, 444721",+7 (646) 471-54-37,ratmirkiselev@example.org
68,Николай Игнатьевич Одинцов,7916,725380,Мишин и партнеры,"с. Шадринск, наб. Ломоносова, д. 67, 654793",8 646 519 3982,aleksandr_2023@example.com
69,Евфросиния Павловна Лаврентьева,2040,503457,ОАО «Исакова-Кудрявцев»,"п. Яшкуль, алл. Калужская, д. 76 к. 879, 886805",8 (911) 352-9096,petr_10@example.org
70,Сократ Ярославович Наумов,7252,724834,Власова Лтд,"к. Павловская, ш. Громова, д. 15 к. 2/5, 112545",8 (387) 571-77-51,anike10@example.com
71,Ларионова Глафира Ефимовна,8668,654816,Шестаков Лтд,"д. Россошь, алл. Черемушки, д. 72 к. 1/4, 966033",+71918255371,darja78@example.net
72,Никанор Тимурович Сафонов,5119,680099,ИП «Крюков»,"ст. Макаров, пер. Промышленный, д. 25 стр. 24, 528669",+7 (966) 278-28-27,visheslav25@example.com
73,Князева Людмила Андреевна,1188,813328,"АО «Колесников, Лапина и Комиссаров»","клх Сухиничи, бул. Сурикова, д. 3/2 к. 134, 384279",8 (881) 914-85-80,trifon1982@example.com
74,Никонов Иосиф Ефимович,2876,814825,НПО «Назаров»,"с. Геленджик, алл. 60 лет Октября, д. 3/3, 309584",88254494812,dsamolova@example.com
75,Василиса Владимировна Крылова,9797,887352,ООО «Носков Федосеева»,"с. Дмитров, бул. Угольный, д. 7/8 стр. 916, 577590",+7 751 863 63 74,kondrati_58@example.net
76,Красильников Святослав Измаилович,5371,905934,Автотор холдинг,"клх Сибай, ул. Авиационная, д. 8/1, 324241",8 415 206 4361,smirnovermil@example.com
77,Капустин Зиновий Ярославович,6573,216970,ТД Ункомтех,"клх Нерчинск, ш. Челюскинцев, д. 27, 611155",+72622189092,mili2010@example.net
78,Надежда Юрьевна Зимина,5808,555884,"ОАО «Кудряшов, Захаров и Зыкова»","ст. Горячинск, бул. Серова, д. 7 стр. 3, 413899",84043898364,sharovazhanna@example.com
79,Иларион Эдуардович Кабанов,3591,575763,Баранов Лтд,"к. Дагомыс, ш. Фадеева, д. 9 к. 27, 910430",+7 684 866 6188,irinamihalova@example.com
80,Русаков Елизар Витальевич,1053,857168,Лапин Групп,"клх Сальск, ш. Волочаевское, д. 731 стр. 179, 210202",8 (588) 425-24-10,pahom_48@example.org
81,Флорентин Артемьевич Чернов,5315,624902,"ЗАО «Молчанов, Макаров и Лебедева»","п. Краснотурьинск, пер. Пограничный, д. 18, 030756",+7 (208) 635-36-54,drozdovmoke@example.org
82,Мясникова Алла Вячеславовна,3927,632342,ОАО «Павлова Тарасов»,"с. Липецк, наб. Дальняя, д. 1/6 к. 54, 759738",+7 (206) 038-5050,vmolchanova@example.net
83,Елисей Данилович Гаврилов,2743,755674,"РАО «Меркушева, Бобров и Третьякова»","г. Кирово-Чепецк, пр. Жуковского, д. 2/2 стр. 26, 623445",8 557 431 32 91,valentinasergeeva@example.com
84,Орест Валерианович Беляков,5889,982554,ОАО «Аксенов-Лихачев»,"к. Голицыно, алл. Свободы, д. 335, 356804",+72067883171,varvarapopova@example.org
85,Елена Владимировна Лазарева,9317,738551,"ИП «Афанасьева, Боброва и Мясникова»","ст. Бугуруслан, ул. Ивановская, д. 3/2, 107029",8 670 662 53 24,prokofi20@example.net
86,Николаева Кира Святославовна,4258,260263,"ЗАО «Кондратьев, Ильин и Захаров»","п. Пятигорск, бул. Ленский, д. 865, 598564",+7 (059) 304-07-85,gordekomarov@example.org
87,Федотова Синклитикия Аркадьевна,7126,899550,ЗАО «Терентьева Орехова»,"ст. Иваново, алл. Карла Маркса, д. 1, 992937",8 (427) 010-3930,samson_1970@example.net
88,Титов Матвей Вячеславович,3646,665579,РАО «Соловьев-Анисимов»,"ст. Тула, ул. Королева, д. 2/6 к. 6, 267528",85392644220,xvladimirova@example.net
89,Елисеев Лукьян Гурьевич,9689,100599,Нефтехимремстрой,"п. Надым, ул. Ручейная, д. 6 стр. 61, 043315",+71006762676,trifon_61@example.com
90,Ульяна Дмитриевна Сорокина,6310,612340,"РАО «Ефремова, Терентьева и Виноградов»","к. Кудымкар, ул. Володарского, д. 36, 815997",+7 629 620 1533,jaksenova@example.net
91,София Захаровна Нестерова,1319,217301,ИП «Мухин-Григорьев»,"д. Усть-Баргузин, алл. Трактовая, д. 1 к. 2/5, 310324",+7 714 677 41 86,margaritadoronina@example.com
92,Прокофий Андреевич Белоусов,6947,972064,"НПО «Назаров, Савельев и Игнатова»","п. Владимир, бул. Чайковского, д. 4/9, 686879",+7 (741) 608-9899,varvaraseliverstova@example.com
93,Сергеев Еремей Георгиевич,6038,351083,РАО «Сазонов Яковлев»,"ст. Ямбург, ш. Отрадное, д. 2, 686854",8 (709) 986-1622,strelkovvatslav@example.net
94,Ия Тарасовна Бобылева,1949,352572,НПО «Лобанов-Комиссаров»,"г. Змеиногорск, пр. Средний, д. 1/7 к. 4, 745054",+74713247546,ponomarevprov@example.org
95,Надежда Рудольфовна Мишина,2290,189814,Мишина и партнеры,"г. Минусинск, пер. 50 лет ВЛКСМ, д. 18 стр. 43, 307053",+75786103579,demjan2024@example.com
96,Шестакова Любовь Валериевна,8962,955662,ООО «Зимина-Власова»,"г. Орск, алл. Прибрежная, д. 43, 680072",+7 (903) 494-46-65,ippolit1982@example.com
97,Шарапова Юлия Никифоровна,2133,897549,Ершов Инк,"к. Всеволожск, ул. Луначарского, д. 6 к. 5, 328309",8 520 744 66 60,mefodivladimirov@example.net
98,Лукин Савелий Ильясович,9727,903035,Моисеев Инкорпорэйтед,"г. Соликамск, бул. Отрадный, д. 25, 534655",+79471709991,evlampi1998@example.net
99,Лаврентий Фадеевич Зайцев,3060,234628,АО «Власов Зимин»,"п. Моздок, алл. Тихая, д. 6/3 стр. 1, 743292",8 (129) 666-67-60,lukinaevpraksija@example.net
100,Агафон Захарьевич Симонов,8787,676510,Щербаков Инк,"п. Нефедова, алл. Пушкинская, д. 9/5 к. 11, 478985",8 257 532 60 33,ekaterinagureva@example.org
101,Романова Варвара Михайловна,3705,377932,Группа М.Видео-Эльдорадо,"ст. Тырныауз, ул. Сосновая, д. 200 стр. 8/7, 847230",+76184992618,bobrovvikenti@example.org
102,г-н Гуляев Каллистрат Германович,9645,736059,ООО «Зыков-Капустин»,"д. Тайшет, бул. Мусы Джалиля, д. 4, 011972",+7 811 437 44 70,avdeevdemid@example.org
103,Майя Кузьминична Котова,7932,322086,Группа Синара,"г. Джубга, бул. Стахановский, д. 6 стр. 5/2, 521667",+76762120216,filaret2008@example.org
104,Гуляева Людмила Юрьевна,9835,891952,ОАО «Карпова»,"с. Гаврилов-Ям, пр. Шоссейный, д. 145 к. 95, 637562",8 (900) 287-7217,ilarion_54@example.org
105,Хохлова Марина Ниловна,4295,847581,РАО «Русаков Белозеров»,"ст. Тамбей, наб. Стадионная, д. 1/2 к. 7/1, 199488",+7 (755) 037-5899,ljudmila2007@example.net
106,Валерий Гурьевич Смирнов,6107,518373,ИП «Федосеева-Калинина»,"клх Воскресенск, алл. 8-е Марта, д. 26, 933163",8 (351) 609-17-79,vsevolod_2024@example.org
107,Васильева Таисия Оскаровна,7118,559381,Меркушев Лтд,"клх Губкин, пр. Космонавтов, д. 7/4, 654722",8 984 858 33 39,zhanna52@example.net
108,Кондратьева Дарья Сергеевна,9479,573417,Тихонова Лимитед,"ст. Нижний Тагил, пр. Марта 8, д. 7 стр. 181, 200342",+74204380571,zahar_2011@example.net
109,Сократ Ермилович Шубин,2982,359947,Мечел,"с. Мичуринск, ул. Полевая, д. 4 стр. 4/6, 347212",+7 (816) 064-84-22,averki57@example.net
110,Алина Владиславовна Гущина,4681,167136,ЗАО «Орлов-Дроздова»,"ст. Хоста, наб. Станционная, д. 9 стр. 92, 826886",+7 533 555 43 98,feliks2016@example.net
111,Агафонов Милан Филатович,6539,122056,ООО «Максимова Самойлова»,"клх Москва, ш. Торговое, д. 5/9 к. 1, 887704",+7 (581) 128-8013,paramonshchukin@example.org
112,Никонов Платон Артёмович,4770,717024,Трансойл,"клх Надым, ул. Уральская, д. 924, 934667",8 650 618 09 19,filatovaanzhela@example.com
113,Валентина Кирилловна Устинова,4608,107540,Мазда Мотор Рус (Mazda),"ст. Самара, пр. Совхозный, д. 3/9 к. 72, 245088",+7 (100) 996-88-14,mechislavsobolev@example.com
114,Раиса Вениаминовна Сорокина,2163,842225,АО «Сидорова Шубина»,"г. Иркутск, ш. Трактовое, д. 9/2 стр. 2, 139755",+7 (314) 913-57-75,iraida92@example.net
115,Константинова Лариса Олеговна,1964,340062,РАО «Исаев Горшков»,"к. Новосибирск, бул. Толстого, д. 8/8, 478129",+7 428 341 10 80,lshilova@example.org
116,Таисия Захаровна Некрасова,2104,132938,Фокин Лимитед,"с. Кизилюрт, бул. Ленина, д. 97 стр. 965, 392827",+7 (299) 275-03-73,belousovmoise@example.org
117,Ершов Спартак Иосипович,6413,174299,"НПО «Гордеева, Буров и Устинова»","клх Муравленко, бул. Бульварный, д. 9, 665918",+76386557790,visheslav_1994@example.org
