owner_id,full_name,passport_series,passport_number,passport_issued_by,address,phone,email
235,Ратмир Гурьевич Голубев,6378,392136,Банк Санкт-Петербург,"г. Кежма, наб. Тюленина, д. 389 к. 2, 625257",+7 509 976 83 89,zhukovaakulina@example.net
236,Варвара Константиновна Фролова,2137,910891,Касторама Рус (Castorama),"г. Джейрах, пр. Чапаева, д. 72 к. 40, 524508",8 403 553 38 03,juvenaliuvarov@example.com
237,Королева Нинель Александровна,5573,468203,ОАО «Иванова»,"г. Диксон, алл. Социалистическая, д. 99, 381674",+7 (336) 293-44-97,kimsamolov@example.com
238,Лыткин Мирослав Тихонович,9346,519093,"АО «Фокин, Бобылев и Сазонов»","ст. Старая Русса, ш. Революции, д. 2/5, 824674",8 (468) 971-52-73,evdokijaivanova@example.org
239,Маргарита Рудольфовна Маслова,9785,447235,"НПО «Силина, Панфилова и Дементьев»","к. Чехов, пр. Партизанский, д. 369, 645875",+7 663 370 5024,ekaterina1978@example.org
240,Селиверстова Галина Андреевна,1452,220944,ОАО «Герасимов»,"клх Черский, пер. Севастопольский, д. 3/7, 488694",8 119 524 36 40,pelagejasmirnova@example.org
241,Игнатов Панкратий Фёдорович,5279,287241,Группа РТК,"п. Озеры, бул. Элеваторный, д. 37, 793230",+7 (346) 791-21-41,rkrilov@example.org
242,Фотий Данилович Архипов,5349,140115,"ООО «Некрасова, Медведев и Соколов»","ст. Алагир, пер. Дачный, д. 138 стр. 9/5, 759655",8 535 669 0551,panovamilitsa@example.net
243,Вера Алексеевна Елисеева,2776,725550,ОАО «Михайлова»,"к. Сеймчан, бул. Шишкина, д. 4/1 стр. 1, 057397",8 915 671 64 93,reginashashkova@example.net
244,Прасковья Антоновна Гусева,8119,462479,"ОАО «Захаров, Елисеев и Пахомова»","с. Гатчина, бул. Слободской, д. 33 к. 116, 564347",+7 287 153 99 15,tsazonova@example.net
245,Щербакова Тамара Оскаровна,6139,557592,АО «Михеев Жуков»,"г. Верхний Уфалей, бул. Енисейский, д. 395 к. 7, 409836",8 552 899 31 60,rodion_1987@example.com
246,Полина Робертовна Куликова,9379,221263,Ермаков Инкорпорэйтед,"к. Тверь, ул. Бульварная, д. 4/8 стр. 7, 523302",8 (642) 086-56-75,esharov@example.net
247,Боброва Евдокия Тимуровна,7311,704596,"РАО «Белоусов, Юдин и Лобанова»","с. Жуковский, алл. Щербакова, д. 5/3 стр. 43, 591266",+7 (015) 720-18-59,jsilina@example.net
248,Николаева Александра Васильевна,4114,367095,НПО «Смирнова Елисеев»,"ст. Верхний Уфалей, ш. Кошевого, д. 8 к. 1, 111783",+7 999 741 9267,kkirillov@example.org
249,Голубев Тимофей Гаврилович,1727,843215,"ОАО «Родионова, Волков и Устинов»","д. Чермоз, бул. Свободный, д. 31 стр. 90, 510293",+7 (184) 011-84-58,nataljafokina@example.net
250,Петухов Аникита Ярославович,8144,101773,ООО «Тарасова-Белозеров»,"клх Мичуринск, наб. Санаторная, д. 103 стр. 52, 298395",+72961844626,boris2023@example.net
251,Гаврила Гертрудович Богданов,9518,945687,Эркафарм,"д. Тихорецк, алл. Маркса Карла, д. 75 стр. 1/4, 418186",+7 515 542 34 01,osilina@example.com
252,Варвара Вячеславовна Назарова,9821,820221,Арконик СМЗ,"д. Нижнекамск, пер. Детский, д. 2 стр. 725, 588967",82408222694,rusakovamargarita@example.net
253,Элеонора Николаевна Крюкова,4228,481913,"АО «Шашков, Рогов и Орехова»","к. Ростов-на-Дону, бул. Курганный, д. 2 стр. 7, 111312",80148706827,sofon2008@example.net
254,Варвара Ниловна Попова,8066,173372,Щербаков Лимитед,"клх Тырныауз, наб. Владимирская, д. 397 стр. 22, 285067",8 251 538 14 47,kapiton30@example.net
255,Карпова Екатерина Константиновна,6409,753425,Мишлен (Michelin),"д. Сузун, наб. Лесная, д. 6/5, 105265",+7 167 318 8261,averjan1978@example.net
256,Рюрик Тихонович Давыдов,6143,795612,ИП «Гордеев-Константинова»,"г. Санкт-Петербург, ш. Октября, д. 62 стр. 1/6, 134026",8 502 374 16 78,elena2010@example.com
257,Милица Сергеевна Владимирова,3041,854717,Новотранс,"г. Анива, алл. Чайковского, д. 630, 906744",8 (163) 928-23-41,kira36@example.org
258,Варфоломей Юлианович Костин,5920,631756,АО «Гурьева Ершова»,"г. Дагомыс, ул. Бульварная, д. 72 к. 293, 668433",8 670 860 4145,mili63@example.com
259,Евгения Аскольдовна Смирнова,6067,799287,ООО «Копылова»,"к. Солнечногорск, пер. Сельский, д. 3/5 к. 6/6, 110825",8 598 953 4396,belozerovvatslav@example.org
260,Елисеева Варвара Аскольдовна,7691,442027,Кондратьева Лимитед,"клх Светлогорск (Калин.), ул. Кутузова, д. 8, 820236",8 (485) 571-6176,sila_2014@example.org
261,Игнатова Василиса Кирилловна,7592,831076,ЗАО «Ильин»,"с. Тымовское, ул. Мелиоративная, д. 9/7 стр. 7/5, 202939",+7 878 844 3448,romanovzahar@example.org
262,Калинина Алина Вениаминовна,5844,681343,АО «Потапов-Мамонтова»,"ст. Касимов, ул. Молодежная, д. 6 стр. 2, 269450",+7 534 240 8916,jaroslav98@example.org
263,Елена Леонидовна Федотова,3085,301158,ЗАО «Боброва Кабанова»,"с. Кирово-Чепецк, бул. Блюхера, д. 3 стр. 2/8, 722397",+7 (404) 226-93-12,kotovinnokenti@example.com
264,Милица Болеславовна Владимирова,7888,797229,Егоров Лимитед,"с. Оренбург, ул. Полевая, д. 223, 290018",8 132 797 2457,zinaidapavlova@example.net
265,Исаева София Васильевна,7211,810219,ОАО «Беляев»,"г. Тихорецк, алл. Молодежная, д. 40 к. 7/3, 436172",+7 314 519 51 51,eliseevaviktorija@example.org
266,Марк Гавриилович Ларионов,3851,745414,"АО «Корнилова, Ефимова и Афанасьева»","к. Воркута, пр. Жукова, д. 2 к. 622, 677119",8 421 522 65 57,ssilin@example.com
267,Калашникова Лора Валентиновна,5930,525800,Башкирская содовая компания,"д. Талдом, пер. 8-е Марта, д. 26 стр. 9/4, 350305",8 (721) 055-2472,pantelemon_1983@example.org
268,Кудрявцев Викторин Викторович,9977,974224,"ООО «Зайцев, Аксенова и Пестова»","г. Воскресенск, пер. Уральский, д. 3/1 стр. 35, 310962",+7 (728) 476-57-04,stepanovaristarh@example.net
269,Ситников Дементий Юлианович,1006,418635,РАО «Вишняков Пахомова»,"д. Красноярск, пер. Фрунзе, д. 36 стр. 2, 236903",8 289 177 56 62,braginamargarita@example.net
270,Касьян Борисович Орлов,5700,320392,ИП «Данилова»,"п. Лесной (Сверд.), пер. Загородный, д. 139, 383034",+7 990 970 05 14,efimovaija@example.com
271,Веселова Марфа Матвеевна,8043,923927,ООО «Давыдова Григорьев»,"клх Теберда, пер. Кавказский, д. 896, 422711",+7 (322) 889-8572,kornil_59@example.com
272,Кулаков Никанор Демидович,6279,587575,ЗАО «Фролова Алексеев»,"г. Амдерма, ш. Некрасова, д. 871, 242149",8 511 274 7472,litkinfilaret@example.com
273,Гордеев Конон Трифонович,8238,563638,"ОАО «Белоусова, Гордеева и Блинова»","к. Тобольск, наб. Королева, д. 868 стр. 1, 380214",8 296 136 71 57,anastasija2000@example.com
274,Королев Велимир Тихонович,4501,636004,"АО «Брагин, Прохоров и Титов»","д. Ступино, бул. Металлургов, д. 147, 723590",86056730306,ippolit21@example.org
275,Маслов Болеслав Ефимович,8752,932291,Втормет,"клх Кропоткин (Краснод.), ш. Трактовое, д. 565, 356778",+7 (659) 608-93-19,lidijaharitonova@example.net
276,Зиновьева Лариса Андреевна,3780,790855,НПО «Рожкова Анисимов»,"г. Плесецк, пер. Школьный, д. 3/8 к. 403, 829635",+7 (390) 550-4481,anna2026@example.com
277,Милован Федотович Галкин,2389,397571,РАО «Шашкова-Казаков»,"к. Ижевск, пер. Тополиный, д. 7/5 стр. 5/2, 110961",8 (981) 789-04-63,radovanzhdanov@example.com
278,Гордеев Рюрик Валерьевич,9445,796101,ОАО «Якушева-Гущин»,"г. Озеры, пер. Дальневосточный, д. 5, 630600",+7 258 955 2963,nikifor_1980@example.net
279,Антонин Федотович Гусев,6491,197923,Новикомбанк,"к. Томпа, пр. Камский, д. 228, 482531",+7 060 920 98 19,vvasilev@example.net
280,Панов Мирон Гаврилович,4848,805477,ООО «Зыкова Зуев»,"д. Кострома, ш. Циолковского, д. 1 стр. 2, 091179",+7 124 421 17 53,fmedvedev@example.org
281,Севастьян Артемьевич Никитин,6085,335552,ГК Автодилерство,"клх Североуральск, алл. Победы, д. 129, 557998",+7 284 139 0808,sinklitikija_1978@example.com
282,Рябов Амвросий Зиновьевич,4262,254511,АО «Сергеев Архипова»,"к. Старая Русса, ул. Тельмана, д. 8, 686342",+7 (461) 994-2376,panfil2003@example.com
283,Юлия Борисовна Кошелева,1400,148458,"НПО «Власов, Яковлева и Крюков»","с. Зарайск, пер. Прудный, д. 5/9, 601256",+7 (531) 355-25-10,zinaida_05@example.org
284,Любим Даниилович Шилов,5011,598216,НПО «Ермаков»,"г. Ухта, бул. Линейный, д. 7/6 к. 4, 077046",+7 172 959 63 90,adam90@example.com
285,Олимпий Алексеевич Самсонов,2193,577538,Самойлова Лтд,"клх Амурск, пр. Кубанский, д. 5/5, 561857",80647715910,anisimsharapov@example.org
286,Марков Поликарп Давидович,7790,760356,РАО «Щербаков Воронова»,"клх Беломорск, ш. Московское, д. 204 к. 6, 422971",+7 (529) 671-88-39,vera1997@example.com
287,Святополк Давидович Тарасов,4185,853240,ОАО «Капустин-Третьякова»,"д. Королев, бул. Высокий, д. 117 стр. 40, 637153",88854728123,nikandr_79@example.net
288,Власов Евгений Арсеньевич,7291,618392,НПО «Суханов-Афанасьева»,"п. Славгород, бул. Рябиновый, д. 80, 407875",+71815632686,marian_1973@example.com
289,Антип Тарасович Гурьев,7547,355836,"АО «Сафонов, Мельников и Константинов»","д. Шилка, пер. Седова, д. 203 к. 11, 943181",+73966613473,evfrosinijakonovalova@example.net
290,Эдуард Ермилович Гурьев,3417,787926,РАО «Фомин»,"ст. Коломна, наб. Ленинская, д. 62, 207650",+7 (412) 095-79-07,savvamakarov@example.org
291,Татьяна Кирилловна Щукина,1090,887443,ЗАО «Новикова Миронов»,"г. Междуреченский, наб. Докучаева, д. 6/9 стр. 8, 570545",8 (971) 480-2632,serge_03@example.net
292,Турова Нина Михайловна,2746,916232,ООО «Борисов Колесников»,"к. Ялуторовск, пер. Химиков, д. 64 стр. 7, 443098",8 916 795 4107,oktjabrinafedoseeva@example.org
293,Калинина Юлия Федоровна,7965,329471,Eurasia Drilling Company,"к. Бодайбо, ул. Просвещения, д. 234 к. 174, 500425",+78821423691,efim07@example.com
294,Никандр Федосьевич Власов,3881,943170,ИП «Князева»,"п. Фатеж, бул. Энергетиков, д. 53 к. 96, 441497",8 (266) 128-7585,mina1994@example.com
295,Октябрина Алексеевна Сысоева,9486,587115,Зайцев Групп,"д. Махачкала, пер. Королева, д. 99, 062607",8 (701) 041-5914,zoja1988@example.org
296,Логинов Сократ Антипович,1822,684482,Шелл Нефть (Shell),"п. Кизилюрт, бул. Поселковый, д. 5 стр. 479, 102918",+7 331 708 76 01,onufri72@example.org
297,София Захаровна Бирюкова,5082,989545,Блинова Групп,"п. Апатиты, алл. Слободская, д. 98, 774419",8 (546) 617-66-20,ratmir19@example.com
298,Антонов Ананий Феофанович,2988,578634,ИП «Блохина»,"клх Серпухов, ул. Аэродромная, д. 9 к. 95, 812259",8 724 461 7679,uljanarogova@example.net
299,Светлана Захаровна Титова,3184,940346,ГСЛ,"г. Балтийск, ш. Аэродромное, д. 21, 753312",8 610 941 01 75,strelkovadarja@example.com
300,Савельев Наркис Венедиктович,8612,800005,Металлстандарт,"к. Сусуман, бул. Февральский, д. 33 к. 9/4, 901302",+7 569 815 2873,filimonsharapov@example.com
